spi-1: 1
spi-1: 1
spi-1: 1
spi-1: 1
spi-1: 1
spi-1: 1
spi-1: 1
spi-1: 1
spi-1: 0
spi-1: 0
spi-1: 1
spi-1: 1
spi-1: 0
spi-1: 1
spi-1: 0
spi-1: 1
spi-1: FF
spi-1: AC
spi-1: 0
spi-1: 1
spi-1: 1
spi-1: 1
spi-1: 1
spi-1: 1
spi-1: 1
spi-1: 1
spi-1: 1
spi-1: 1
spi-1: 0
spi-1: 0
spi-1: 1
spi-1: 0
spi-1: 1
spi-1: 0
spi-1: FE
spi-1: 53
spi-1: 1
spi-1: 1
spi-1: 0
spi-1: 0
spi-1: 1
spi-1: 0
spi-1: 1
spi-1: 0
spi-1: 0
spi-1: 0
spi-1: 0
spi-1: 0
spi-1: 0
spi-1: 0
spi-1: 0
spi-1: 0
spi-1: 53
spi-1: 00
avr_isp-1: Programming enable
avr_isp-1: Warning: Unexpected bytes in reply!
spi-1: 0
spi-1: 0
spi-1: 0
spi-1: 0
spi-1: 0
spi-1: 0
spi-1: 0
spi-1: 0
spi-1: 0
spi-1: 0
spi-1: 0
spi-1: 0
spi-1: 0
spi-1: 0
spi-1: 0
spi-1: 0
spi-1: 00
spi-1: 00
spi-1: 0
spi-1: 0
spi-1: 0
spi-1: 0
spi-1: 0
spi-1: 0
spi-1: 0
spi-1: 0
spi-1: 0
spi-1: 0
spi-1: 0
spi-1: 0
spi-1: 1
spi-1: 1
spi-1: 0
spi-1: 0
spi-1: 00
spi-1: 30
spi-1: 0
spi-1: 0
spi-1: 0
spi-1: 0
spi-1: 1
spi-1: 1
spi-1: 0
spi-1: 0
spi-1: 0
spi-1: 0
spi-1: 0
spi-1: 0
spi-1: 0
spi-1: 0
spi-1: 0
spi-1: 0
spi-1: 30
spi-1: 00
spi-1: 0
spi-1: 0
spi-1: 0
spi-1: 0
spi-1: 0
spi-1: 0
spi-1: 0
spi-1: 0
spi-1: 0
spi-1: 0
spi-1: 0
spi-1: 0
spi-1: 0
spi-1: 0
spi-1: 0
spi-1: 0
spi-1: 00
spi-1: 00
avr_isp-1: Vendor code: 0x1e (Atmel)
spi-1: 0
spi-1: 1
spi-1: 1
spi-1: 1
spi-1: 1
spi-1: 0
spi-1: 0
spi-1: 0
spi-1: 0
spi-1: 0
spi-1: 0
spi-1: 0
spi-1: 0
spi-1: 0
spi-1: 0
spi-1: 0
spi-1: 1E
spi-1: 00
spi-1: 0
spi-1: 0
spi-1: 0
spi-1: 0
spi-1: 0
spi-1: 0
spi-1: 0
spi-1: 0
spi-1: 0
spi-1: 0
spi-1: 0
spi-1: 0
spi-1: 1
spi-1: 1
spi-1: 0
spi-1: 0
spi-1: 00
spi-1: 30
spi-1: 0
spi-1: 0
spi-1: 0
spi-1: 0
spi-1: 1
spi-1: 1
spi-1: 0
spi-1: 0
spi-1: 0
spi-1: 0
spi-1: 0
spi-1: 0
spi-1: 0
spi-1: 0
spi-1: 0
spi-1: 0
spi-1: 30
spi-1: 00
spi-1: 0
spi-1: 0
spi-1: 0
spi-1: 0
spi-1: 0
spi-1: 0
spi-1: 0
spi-1: 0
spi-1: 1
spi-1: 0
spi-1: 0
spi-1: 0
spi-1: 0
spi-1: 0
spi-1: 0
spi-1: 0
spi-1: 00
spi-1: 01
avr_isp-1: Part family / memory size: 0x93
spi-1: 1
spi-1: 1
spi-1: 0
spi-1: 0
spi-1: 1
spi-1: 0
spi-1: 0
spi-1: 1
spi-1: 0
spi-1: 0
spi-1: 0
spi-1: 0
spi-1: 0
spi-1: 0
spi-1: 0
spi-1: 0
spi-1: 93
spi-1: 00
spi-1: 0
spi-1: 0
spi-1: 0
spi-1: 0
spi-1: 0
spi-1: 0
spi-1: 0
spi-1: 0
spi-1: 0
spi-1: 0
spi-1: 0
spi-1: 0
spi-1: 1
spi-1: 1
spi-1: 0
spi-1: 0
spi-1: 00
spi-1: 30
spi-1: 0
spi-1: 0
spi-1: 0
spi-1: 0
spi-1: 1
spi-1: 1
spi-1: 0
spi-1: 0
spi-1: 0
spi-1: 0
spi-1: 0
spi-1: 0
spi-1: 0
spi-1: 0
spi-1: 0
spi-1: 0
spi-1: 30
spi-1: 00
spi-1: 0
spi-1: 0
spi-1: 0
spi-1: 0
spi-1: 0
spi-1: 0
spi-1: 0
spi-1: 0
spi-1: 0
spi-1: 1
spi-1: 0
spi-1: 0
spi-1: 0
spi-1: 0
spi-1: 0
spi-1: 0
spi-1: 00
spi-1: 02
avr_isp-1: Part number: 0x0a
avr_isp-1: Device: Atmel ATmega88
spi-1: 0
spi-1: 1
spi-1: 0
spi-1: 1
spi-1: 0
spi-1: 0
spi-1: 0
spi-1: 0
spi-1: 0
spi-1: 0
spi-1: 0
spi-1: 0
spi-1: 0
spi-1: 0
spi-1: 0
spi-1: 0
spi-1: 0A
spi-1: 00
spi-1: 0
spi-1: 0
spi-1: 0
spi-1: 0
spi-1: 0
spi-1: 0
spi-1: 0
spi-1: 0
spi-1: 0
spi-1: 0
spi-1: 0
spi-1: 0
spi-1: 1
spi-1: 0
spi-1: 1
spi-1: 0
spi-1: 00
spi-1: 50
spi-1: 0
spi-1: 0
spi-1: 0
spi-1: 0
spi-1: 1
spi-1: 0
spi-1: 1
spi-1: 0
spi-1: 0
spi-1: 0
spi-1: 0
spi-1: 0
spi-1: 0
spi-1: 0
spi-1: 0
spi-1: 0
spi-1: 50
spi-1: 00
spi-1: 0
spi-1: 0
spi-1: 0
spi-1: 0
spi-1: 0
spi-1: 0
spi-1: 0
spi-1: 0
spi-1: 0
spi-1: 0
spi-1: 0
spi-1: 0
spi-1: 0
spi-1: 0
spi-1: 0
spi-1: 0
spi-1: 00
spi-1: 00
avr_isp-1: Read fuse bits: 0xff
spi-1: 1
spi-1: 1
spi-1: 1
spi-1: 1
spi-1: 1
spi-1: 1
spi-1: 1
spi-1: 1
spi-1: 0
spi-1: 0
spi-1: 0
spi-1: 0
spi-1: 0
spi-1: 0
spi-1: 0
spi-1: 0
spi-1: FF
spi-1: 00
spi-1: 0
spi-1: 0
spi-1: 0
spi-1: 0
spi-1: 0
spi-1: 0
spi-1: 0
spi-1: 0
spi-1: 0
spi-1: 0
spi-1: 0
spi-1: 0
spi-1: 1
spi-1: 0
spi-1: 1
spi-1: 0
spi-1: 00
spi-1: 50
spi-1: 0
spi-1: 0
spi-1: 0
spi-1: 0
spi-1: 1
spi-1: 0
spi-1: 1
spi-1: 0
spi-1: 0
spi-1: 0
spi-1: 0
spi-1: 0
spi-1: 0
spi-1: 0
spi-1: 0
spi-1: 0
spi-1: 50
spi-1: 00
spi-1: 0
spi-1: 0
spi-1: 0
spi-1: 0
spi-1: 0
spi-1: 0
spi-1: 0
spi-1: 0
spi-1: 0
spi-1: 0
spi-1: 0
spi-1: 0
spi-1: 0
spi-1: 0
spi-1: 0
spi-1: 0
spi-1: 00
spi-1: 00
avr_isp-1: Read fuse bits: 0xff
spi-1: 1
spi-1: 1
spi-1: 1
spi-1: 1
spi-1: 1
spi-1: 1
spi-1: 1
spi-1: 1
spi-1: 0
spi-1: 0
spi-1: 0
spi-1: 0
spi-1: 0
spi-1: 0
spi-1: 0
spi-1: 0
spi-1: FF
spi-1: 00
spi-1: 0
spi-1: 0
spi-1: 0
spi-1: 0
spi-1: 0
spi-1: 0
spi-1: 0
spi-1: 0
spi-1: 0
spi-1: 0
spi-1: 0
spi-1: 0
spi-1: 1
spi-1: 0
spi-1: 1
spi-1: 0
spi-1: 00
spi-1: 50
spi-1: 0
spi-1: 0
spi-1: 0
spi-1: 0
spi-1: 1
spi-1: 0
spi-1: 1
spi-1: 0
spi-1: 0
spi-1: 0
spi-1: 0
spi-1: 0
spi-1: 0
spi-1: 0
spi-1: 0
spi-1: 0
spi-1: 50
spi-1: 00
spi-1: 0
spi-1: 0
spi-1: 0
spi-1: 0
spi-1: 0
spi-1: 0
spi-1: 0
spi-1: 0
spi-1: 0
spi-1: 0
spi-1: 0
spi-1: 0
spi-1: 0
spi-1: 0
spi-1: 0
spi-1: 0
spi-1: 00
spi-1: 00
avr_isp-1: Read fuse bits: 0xff
spi-1: 1
spi-1: 1
spi-1: 1
spi-1: 1
spi-1: 1
spi-1: 1
spi-1: 1
spi-1: 1
spi-1: 0
spi-1: 0
spi-1: 0
spi-1: 0
spi-1: 0
spi-1: 0
spi-1: 0
spi-1: 0
spi-1: FF
spi-1: 00
spi-1: 0
spi-1: 0
spi-1: 0
spi-1: 0
spi-1: 0
spi-1: 0
spi-1: 0
spi-1: 0
spi-1: 0
spi-1: 0
spi-1: 0
spi-1: 1
spi-1: 1
spi-1: 0
spi-1: 1
spi-1: 0
spi-1: 00
spi-1: 58
spi-1: 0
spi-1: 0
spi-1: 0
spi-1: 1
spi-1: 1
spi-1: 0
spi-1: 1
spi-1: 0
spi-1: 0
spi-1: 0
spi-1: 0
spi-1: 1
spi-1: 0
spi-1: 0
spi-1: 0
spi-1: 0
spi-1: 58
spi-1: 08
spi-1: 0
spi-1: 0
spi-1: 0
spi-1: 1
spi-1: 0
spi-1: 0
spi-1: 0
spi-1: 0
spi-1: 0
spi-1: 0
spi-1: 0
spi-1: 0
spi-1: 0
spi-1: 0
spi-1: 0
spi-1: 0
spi-1: 08
spi-1: 00
avr_isp-1: Read fuse high bits: 0xdf
spi-1: 1
spi-1: 1
spi-1: 1
spi-1: 1
spi-1: 1
spi-1: 0
spi-1: 1
spi-1: 1
spi-1: 0
spi-1: 0
spi-1: 0
spi-1: 0
spi-1: 0
spi-1: 0
spi-1: 0
spi-1: 0
spi-1: DF
spi-1: 00
spi-1: 0
spi-1: 0
spi-1: 0
spi-1: 0
spi-1: 0
spi-1: 0
spi-1: 0
spi-1: 0
spi-1: 0
spi-1: 0
spi-1: 0
spi-1: 1
spi-1: 1
spi-1: 0
spi-1: 1
spi-1: 0
spi-1: 00
spi-1: 58
spi-1: 0
spi-1: 0
spi-1: 0
spi-1: 1
spi-1: 1
spi-1: 0
spi-1: 1
spi-1: 0
spi-1: 0
spi-1: 0
spi-1: 0
spi-1: 1
spi-1: 0
spi-1: 0
spi-1: 0
spi-1: 0
spi-1: 58
spi-1: 08
spi-1: 0
spi-1: 0
spi-1: 0
spi-1: 1
spi-1: 0
spi-1: 0
spi-1: 0
spi-1: 0
spi-1: 0
spi-1: 0
spi-1: 0
spi-1: 0
spi-1: 0
spi-1: 0
spi-1: 0
spi-1: 0
spi-1: 08
spi-1: 00
avr_isp-1: Read fuse high bits: 0xdf
spi-1: 1
spi-1: 1
spi-1: 1
spi-1: 1
spi-1: 1
spi-1: 0
spi-1: 1
spi-1: 1
spi-1: 0
spi-1: 0
spi-1: 0
spi-1: 0
spi-1: 0
spi-1: 0
spi-1: 0
spi-1: 0
spi-1: DF
spi-1: 00
spi-1: 0
spi-1: 0
spi-1: 0
spi-1: 0
spi-1: 0
spi-1: 0
spi-1: 0
spi-1: 0
spi-1: 0
spi-1: 0
spi-1: 0
spi-1: 1
spi-1: 1
spi-1: 0
spi-1: 1
spi-1: 0
spi-1: 00
spi-1: 58
spi-1: 0
spi-1: 0
spi-1: 0
spi-1: 1
spi-1: 1
spi-1: 0
spi-1: 1
spi-1: 0
spi-1: 0
spi-1: 0
spi-1: 0
spi-1: 1
spi-1: 0
spi-1: 0
spi-1: 0
spi-1: 0
spi-1: 58
spi-1: 08
spi-1: 0
spi-1: 0
spi-1: 0
spi-1: 1
spi-1: 0
spi-1: 0
spi-1: 0
spi-1: 0
spi-1: 0
spi-1: 0
spi-1: 0
spi-1: 0
spi-1: 0
spi-1: 0
spi-1: 0
spi-1: 0
spi-1: 08
spi-1: 00
avr_isp-1: Read fuse high bits: 0xdf
spi-1: 1
spi-1: 1
spi-1: 1
spi-1: 1
spi-1: 1
spi-1: 0
spi-1: 1
spi-1: 1
spi-1: 0
spi-1: 0
spi-1: 0
spi-1: 0
spi-1: 0
spi-1: 0
spi-1: 0
spi-1: 0
spi-1: DF
spi-1: 00
spi-1: 0
spi-1: 0
spi-1: 0
spi-1: 0
spi-1: 0
spi-1: 0
spi-1: 0
spi-1: 0
spi-1: 0
spi-1: 0
spi-1: 0
spi-1: 0
spi-1: 1
spi-1: 0
spi-1: 1
spi-1: 0
spi-1: 00
spi-1: 50
spi-1: 0
spi-1: 0
spi-1: 0
spi-1: 0
spi-1: 1
spi-1: 0
spi-1: 1
spi-1: 0
spi-1: 0
spi-1: 0
spi-1: 0
spi-1: 1
spi-1: 0
spi-1: 0
spi-1: 0
spi-1: 0
spi-1: 50
spi-1: 08
spi-1: 0
spi-1: 0
spi-1: 0
spi-1: 1
spi-1: 0
spi-1: 0
spi-1: 0
spi-1: 0
spi-1: 0
spi-1: 0
spi-1: 0
spi-1: 0
spi-1: 0
spi-1: 0
spi-1: 0
spi-1: 0
spi-1: 08
spi-1: 00
avr_isp-1: Read extended fuse bits: 0xf9
spi-1: 1
spi-1: 0
spi-1: 0
spi-1: 1
spi-1: 1
spi-1: 1
spi-1: 1
spi-1: 1
spi-1: 0
spi-1: 0
spi-1: 0
spi-1: 0
spi-1: 0
spi-1: 0
spi-1: 0
spi-1: 0
spi-1: F9
spi-1: 00
spi-1: 0
spi-1: 0
spi-1: 0
spi-1: 0
spi-1: 0
spi-1: 0
spi-1: 0
spi-1: 0
spi-1: 0
spi-1: 0
spi-1: 0
spi-1: 0
spi-1: 1
spi-1: 0
spi-1: 1
spi-1: 0
spi-1: 00
spi-1: 50
spi-1: 0
spi-1: 0
spi-1: 0
spi-1: 0
spi-1: 1
spi-1: 0
spi-1: 1
spi-1: 0
spi-1: 0
spi-1: 0
spi-1: 0
spi-1: 1
spi-1: 0
spi-1: 0
spi-1: 0
spi-1: 0
spi-1: 50
spi-1: 08
spi-1: 0
spi-1: 0
spi-1: 0
spi-1: 1
spi-1: 0
spi-1: 0
spi-1: 0
spi-1: 0
spi-1: 0
spi-1: 0
spi-1: 0
spi-1: 0
spi-1: 0
spi-1: 0
spi-1: 0
spi-1: 0
spi-1: 08
spi-1: 00
avr_isp-1: Read extended fuse bits: 0xf9
spi-1: 1
spi-1: 0
spi-1: 0
spi-1: 1
spi-1: 1
spi-1: 1
spi-1: 1
spi-1: 1
spi-1: 0
spi-1: 0
spi-1: 0
spi-1: 0
spi-1: 0
spi-1: 0
spi-1: 0
spi-1: 0
spi-1: F9
spi-1: 00
spi-1: 0
spi-1: 0
spi-1: 0
spi-1: 0
spi-1: 0
spi-1: 0
spi-1: 0
spi-1: 0
spi-1: 0
spi-1: 0
spi-1: 0
spi-1: 0
spi-1: 1
spi-1: 0
spi-1: 1
spi-1: 0
spi-1: 00
spi-1: 50
spi-1: 0
spi-1: 0
spi-1: 0
spi-1: 0
spi-1: 1
spi-1: 0
spi-1: 1
spi-1: 0
spi-1: 0
spi-1: 0
spi-1: 0
spi-1: 1
spi-1: 0
spi-1: 0
spi-1: 0
spi-1: 0
spi-1: 50
spi-1: 08
spi-1: 0
spi-1: 0
spi-1: 0
spi-1: 1
spi-1: 0
spi-1: 0
spi-1: 0
spi-1: 0
spi-1: 0
spi-1: 0
spi-1: 0
spi-1: 0
spi-1: 0
spi-1: 0
spi-1: 0
spi-1: 0
spi-1: 08
spi-1: 00
avr_isp-1: Read extended fuse bits: 0xf9
spi-1: 1
spi-1: 0
spi-1: 0
spi-1: 1
spi-1: 1
spi-1: 1
spi-1: 1
spi-1: 1
spi-1: 0
spi-1: 0
spi-1: 0
spi-1: 0
spi-1: 0
spi-1: 0
spi-1: 0
spi-1: 0
spi-1: F9
spi-1: 00
spi-1: 0
spi-1: 0
spi-1: 0
spi-1: 0
spi-1: 0
spi-1: 0
spi-1: 0
spi-1: 0
spi-1: 0
spi-1: 0
spi-1: 0
spi-1: 0
spi-1: 0
spi-1: 1
spi-1: 0
spi-1: 1
spi-1: 00
spi-1: A0
spi-1: 0
spi-1: 0
spi-1: 0
spi-1: 0
spi-1: 0
spi-1: 1
spi-1: 0
spi-1: 1
spi-1: 1
spi-1: 0
spi-1: 0
spi-1: 0
spi-1: 0
spi-1: 0
spi-1: 0
spi-1: 0
spi-1: A0
spi-1: 01
spi-1: 1
spi-1: 0
spi-1: 0
spi-1: 0
spi-1: 0
spi-1: 0
spi-1: 0
spi-1: 0
spi-1: 0
spi-1: 0
spi-1: 1
spi-1: 1
spi-1: 1
spi-1: 1
spi-1: 1
spi-1: 1
spi-1: 01
spi-1: FC
avr_isp-1: Unknown command: a0 01 fc 00 (reply: 00 a0 01 ff)!
spi-1: 1
spi-1: 1
spi-1: 1
spi-1: 1
spi-1: 1
spi-1: 1
spi-1: 1
spi-1: 1
spi-1: 0
spi-1: 0
spi-1: 0
spi-1: 0
spi-1: 0
spi-1: 0
spi-1: 0
spi-1: 0
spi-1: FF
spi-1: 00
spi-1: 0
spi-1: 0
spi-1: 0
spi-1: 0
spi-1: 0
spi-1: 0
spi-1: 0
spi-1: 0
spi-1: 0
spi-1: 0
spi-1: 0
spi-1: 0
spi-1: 0
spi-1: 1
spi-1: 0
spi-1: 1
spi-1: 00
spi-1: A0
spi-1: 0
spi-1: 0
spi-1: 0
spi-1: 0
spi-1: 0
spi-1: 1
spi-1: 0
spi-1: 1
spi-1: 1
spi-1: 0
spi-1: 0
spi-1: 0
spi-1: 0
spi-1: 0
spi-1: 0
spi-1: 0
spi-1: A0
spi-1: 01
spi-1: 1
spi-1: 0
spi-1: 0
spi-1: 0
spi-1: 0
spi-1: 0
spi-1: 0
spi-1: 0
spi-1: 1
spi-1: 0
spi-1: 1
spi-1: 1
spi-1: 1
spi-1: 1
spi-1: 1
spi-1: 1
spi-1: 01
spi-1: FD
avr_isp-1: Unknown command: a0 01 fd 00 (reply: 00 a0 01 ff)!
spi-1: 1
spi-1: 1
spi-1: 1
spi-1: 1
spi-1: 1
spi-1: 1
spi-1: 1
spi-1: 1
spi-1: 0
spi-1: 0
spi-1: 0
spi-1: 0
spi-1: 0
spi-1: 0
spi-1: 0
spi-1: 0
spi-1: FF
spi-1: 00
spi-1: 0
spi-1: 0
spi-1: 0
spi-1: 0
spi-1: 0
spi-1: 0
spi-1: 0
spi-1: 0
spi-1: 0
spi-1: 0
spi-1: 0
spi-1: 0
spi-1: 0
spi-1: 1
spi-1: 0
spi-1: 1
spi-1: 00
spi-1: A0
spi-1: 0
spi-1: 0
spi-1: 0
spi-1: 0
spi-1: 0
spi-1: 1
spi-1: 0
spi-1: 1
spi-1: 1
spi-1: 0
spi-1: 0
spi-1: 0
spi-1: 0
spi-1: 0
spi-1: 0
spi-1: 0
spi-1: A0
spi-1: 01
spi-1: 1
spi-1: 0
spi-1: 0
spi-1: 0
spi-1: 0
spi-1: 0
spi-1: 0
spi-1: 0
spi-1: 0
spi-1: 1
spi-1: 1
spi-1: 1
spi-1: 1
spi-1: 1
spi-1: 1
spi-1: 1
spi-1: 01
spi-1: FE
avr_isp-1: Unknown command: a0 01 fe 00 (reply: 00 a0 01 ff)!
spi-1: 1
spi-1: 1
spi-1: 1
spi-1: 1
spi-1: 1
spi-1: 1
spi-1: 1
spi-1: 1
spi-1: 0
spi-1: 0
spi-1: 0
spi-1: 0
spi-1: 0
spi-1: 0
spi-1: 0
spi-1: 0
spi-1: FF
spi-1: 00
spi-1: 0
spi-1: 0
spi-1: 0
spi-1: 0
spi-1: 0
spi-1: 0
spi-1: 0
spi-1: 0
spi-1: 0
spi-1: 0
spi-1: 0
spi-1: 0
spi-1: 0
spi-1: 1
spi-1: 0
spi-1: 1
spi-1: 00
spi-1: A0
spi-1: 0
spi-1: 0
spi-1: 0
spi-1: 0
spi-1: 0
spi-1: 1
spi-1: 0
spi-1: 1
spi-1: 1
spi-1: 0
spi-1: 0
spi-1: 0
spi-1: 0
spi-1: 0
spi-1: 0
spi-1: 0
spi-1: A0
spi-1: 01
spi-1: 1
spi-1: 0
spi-1: 0
spi-1: 0
spi-1: 0
spi-1: 0
spi-1: 0
spi-1: 0
spi-1: 1
spi-1: 1
spi-1: 1
spi-1: 1
spi-1: 1
spi-1: 1
spi-1: 1
spi-1: 1
spi-1: 01
spi-1: FF
avr_isp-1: Unknown command: a0 01 ff 00 (reply: 00 a0 01 ff)!
spi-1: 1
spi-1: 1
spi-1: 1
spi-1: 1
spi-1: 1
spi-1: 1
spi-1: 1
spi-1: 1
spi-1: 0
spi-1: 0
spi-1: 0
spi-1: 0
spi-1: 0
spi-1: 0
spi-1: 0
spi-1: 0
spi-1: FF
spi-1: 00
spi-1: 0
spi-1: 0
spi-1: 0
spi-1: 0
spi-1: 0
spi-1: 0
spi-1: 0
spi-1: 0
spi-1: 0
spi-1: 0
spi-1: 1
spi-1: 1
spi-1: 0
spi-1: 1
spi-1: 0
spi-1: 1
spi-1: 00
spi-1: AC
spi-1: 0
spi-1: 0
spi-1: 1
spi-1: 1
spi-1: 0
spi-1: 1
spi-1: 0
spi-1: 1
spi-1: 1
spi-1: 1
spi-1: 1
spi-1: 1
spi-1: 1
spi-1: 0
spi-1: 0
spi-1: 1
spi-1: AC
spi-1: 9F
spi-1: 1
spi-1: 1
spi-1: 1
spi-1: 1
spi-1: 1
spi-1: 0
spi-1: 0
spi-1: 1
spi-1: 0
spi-1: 0
spi-1: 0
spi-1: 0
spi-1: 0
spi-1: 0
spi-1: 0
spi-1: 0
spi-1: 9F
spi-1: 00
avr_isp-1: Chip erase
spi-1: 0
spi-1: 0
spi-1: 0
spi-1: 0
spi-1: 0
spi-1: 0
spi-1: 0
spi-1: 0
spi-1: 0
spi-1: 0
spi-1: 0
spi-1: 0
spi-1: 0
spi-1: 0
spi-1: 0
spi-1: 0
spi-1: 00
spi-1: 00
spi-1: 1
spi-1: 1
spi-1: 1
spi-1: 1
spi-1: 1
spi-1: 1
spi-1: 1
spi-1: 1
spi-1: 0
spi-1: 0
spi-1: 1
spi-1: 1
spi-1: 0
spi-1: 1
spi-1: 0
spi-1: 1
spi-1: FF
spi-1: AC
spi-1: 0
spi-1: 1
spi-1: 1
spi-1: 1
spi-1: 1
spi-1: 1
spi-1: 1
spi-1: 1
spi-1: 1
spi-1: 1
spi-1: 0
spi-1: 0
spi-1: 1
spi-1: 0
spi-1: 1
spi-1: 0
spi-1: FE
spi-1: 53
spi-1: 1
spi-1: 1
spi-1: 0
spi-1: 0
spi-1: 1
spi-1: 0
spi-1: 1
spi-1: 0
spi-1: 0
spi-1: 0
spi-1: 0
spi-1: 0
spi-1: 0
spi-1: 0
spi-1: 0
spi-1: 0
spi-1: 53
spi-1: 00
avr_isp-1: Programming enable
avr_isp-1: Warning: Unexpected bytes in reply!
spi-1: 0
spi-1: 0
spi-1: 0
spi-1: 0
spi-1: 0
spi-1: 0
spi-1: 0
spi-1: 0
spi-1: 0
spi-1: 0
spi-1: 0
spi-1: 0
spi-1: 0
spi-1: 0
spi-1: 0
spi-1: 0
spi-1: 00
spi-1: 00
spi-1: 0
spi-1: 0
spi-1: 0
spi-1: 0
spi-1: 0
spi-1: 0
spi-1: 0
spi-1: 0
spi-1: 0
spi-1: 0
spi-1: 0
spi-1: 0
spi-1: 1
spi-1: 0
spi-1: 1
spi-1: 0
spi-1: 00
spi-1: 50
spi-1: 0
spi-1: 0
spi-1: 0
spi-1: 0
spi-1: 1
spi-1: 0
spi-1: 1
spi-1: 0
spi-1: 0
spi-1: 0
spi-1: 0
spi-1: 0
spi-1: 0
spi-1: 0
spi-1: 0
spi-1: 0
spi-1: 50
spi-1: 00
spi-1: 0
spi-1: 0
spi-1: 0
spi-1: 0
spi-1: 0
spi-1: 0
spi-1: 0
spi-1: 0
spi-1: 0
spi-1: 0
spi-1: 0
spi-1: 0
spi-1: 0
spi-1: 0
spi-1: 0
spi-1: 0
spi-1: 00
spi-1: 00
avr_isp-1: Read fuse bits: 0xff
spi-1: 1
spi-1: 1
spi-1: 1
spi-1: 1
spi-1: 1
spi-1: 1
spi-1: 1
spi-1: 1
spi-1: 0
spi-1: 0
spi-1: 0
spi-1: 0
spi-1: 0
spi-1: 0
spi-1: 0
spi-1: 0
spi-1: FF
spi-1: 00
spi-1: 0
spi-1: 0
spi-1: 0
spi-1: 0
spi-1: 0
spi-1: 0
spi-1: 0
spi-1: 0
spi-1: 0
spi-1: 0
spi-1: 0
spi-1: 0
spi-1: 1
spi-1: 0
spi-1: 1
spi-1: 0
spi-1: 00
spi-1: 50
spi-1: 0
spi-1: 0
spi-1: 0
spi-1: 0
spi-1: 1
spi-1: 0
spi-1: 1
spi-1: 0
spi-1: 0
spi-1: 0
spi-1: 0
spi-1: 0
spi-1: 0
spi-1: 0
spi-1: 0
spi-1: 0
spi-1: 50
spi-1: 00
spi-1: 0
spi-1: 0
spi-1: 0
spi-1: 0
spi-1: 0
spi-1: 0
spi-1: 0
spi-1: 0
spi-1: 0
spi-1: 0
spi-1: 0
spi-1: 0
spi-1: 0
spi-1: 0
spi-1: 0
spi-1: 0
spi-1: 00
spi-1: 00
avr_isp-1: Read fuse bits: 0xff
spi-1: 1
spi-1: 1
spi-1: 1
spi-1: 1
spi-1: 1
spi-1: 1
spi-1: 1
spi-1: 1
spi-1: 0
spi-1: 0
spi-1: 0
spi-1: 0
spi-1: 0
spi-1: 0
spi-1: 0
spi-1: 0
spi-1: FF
spi-1: 00
spi-1: 0
spi-1: 0
spi-1: 0
spi-1: 0
spi-1: 0
spi-1: 0
spi-1: 0
spi-1: 0
spi-1: 0
spi-1: 0
spi-1: 0
spi-1: 0
spi-1: 1
spi-1: 0
spi-1: 1
spi-1: 0
spi-1: 00
spi-1: 50
spi-1: 0
spi-1: 0
spi-1: 0
spi-1: 0
spi-1: 1
spi-1: 0
spi-1: 1
spi-1: 0
spi-1: 0
spi-1: 0
spi-1: 0
spi-1: 0
spi-1: 0
spi-1: 0
spi-1: 0
spi-1: 0
spi-1: 50
spi-1: 00
spi-1: 0
spi-1: 0
spi-1: 0
spi-1: 0
spi-1: 0
spi-1: 0
spi-1: 0
spi-1: 0
spi-1: 0
spi-1: 0
spi-1: 0
spi-1: 0
spi-1: 0
spi-1: 0
spi-1: 0
spi-1: 0
spi-1: 00
spi-1: 00
avr_isp-1: Read fuse bits: 0xff
spi-1: 1
spi-1: 1
spi-1: 1
spi-1: 1
spi-1: 1
spi-1: 1
spi-1: 1
spi-1: 1
spi-1: 0
spi-1: 0
spi-1: 0
spi-1: 0
spi-1: 0
spi-1: 0
spi-1: 0
spi-1: 0
spi-1: FF
spi-1: 00
spi-1: 0
spi-1: 0
spi-1: 0
spi-1: 0
spi-1: 0
spi-1: 0
spi-1: 0
spi-1: 0
spi-1: 0
spi-1: 0
spi-1: 0
spi-1: 1
spi-1: 1
spi-1: 0
spi-1: 1
spi-1: 0
spi-1: 00
spi-1: 58
spi-1: 0
spi-1: 0
spi-1: 0
spi-1: 1
spi-1: 1
spi-1: 0
spi-1: 1
spi-1: 0
spi-1: 0
spi-1: 0
spi-1: 0
spi-1: 1
spi-1: 0
spi-1: 0
spi-1: 0
spi-1: 0
spi-1: 58
spi-1: 08
spi-1: 0
spi-1: 0
spi-1: 0
spi-1: 1
spi-1: 0
spi-1: 0
spi-1: 0
spi-1: 0
spi-1: 0
spi-1: 0
spi-1: 0
spi-1: 0
spi-1: 0
spi-1: 0
spi-1: 0
spi-1: 0
spi-1: 08
spi-1: 00
avr_isp-1: Read fuse high bits: 0xdf
spi-1: 1
spi-1: 1
spi-1: 1
spi-1: 1
spi-1: 1
spi-1: 0
spi-1: 1
spi-1: 1
spi-1: 0
spi-1: 0
spi-1: 0
spi-1: 0
spi-1: 0
spi-1: 0
spi-1: 0
spi-1: 0
spi-1: DF
spi-1: 00
spi-1: 0
spi-1: 0
spi-1: 0
spi-1: 0
spi-1: 0
spi-1: 0
spi-1: 0
spi-1: 0
spi-1: 0
spi-1: 0
spi-1: 0
spi-1: 1
spi-1: 1
spi-1: 0
spi-1: 1
spi-1: 0
spi-1: 00
spi-1: 58
spi-1: 0
spi-1: 0
spi-1: 0
spi-1: 1
spi-1: 1
spi-1: 0
spi-1: 1
spi-1: 0
spi-1: 0
spi-1: 0
spi-1: 0
spi-1: 1
spi-1: 0
spi-1: 0
spi-1: 0
spi-1: 0
spi-1: 58
spi-1: 08
spi-1: 0
spi-1: 0
spi-1: 0
spi-1: 1
spi-1: 0
spi-1: 0
spi-1: 0
spi-1: 0
spi-1: 0
spi-1: 0
spi-1: 0
spi-1: 0
spi-1: 0
spi-1: 0
spi-1: 0
spi-1: 0
spi-1: 08
spi-1: 00
avr_isp-1: Read fuse high bits: 0xdf
spi-1: 1
spi-1: 1
spi-1: 1
spi-1: 1
spi-1: 1
spi-1: 0
spi-1: 1
spi-1: 1
spi-1: 0
spi-1: 0
spi-1: 0
spi-1: 0
spi-1: 0
spi-1: 0
spi-1: 0
spi-1: 0
spi-1: DF
spi-1: 00
spi-1: 0
spi-1: 0
spi-1: 0
spi-1: 0
spi-1: 0
spi-1: 0
spi-1: 0
spi-1: 0
spi-1: 0
spi-1: 0
spi-1: 0
spi-1: 1
spi-1: 1
spi-1: 0
spi-1: 1
spi-1: 0
spi-1: 00
spi-1: 58
spi-1: 0
spi-1: 0
spi-1: 0
spi-1: 1
spi-1: 1
spi-1: 0
spi-1: 1
spi-1: 0
spi-1: 0
spi-1: 0
spi-1: 0
spi-1: 1
spi-1: 0
spi-1: 0
spi-1: 0
spi-1: 0
spi-1: 58
spi-1: 08
spi-1: 0
spi-1: 0
spi-1: 0
spi-1: 1
spi-1: 0
spi-1: 0
spi-1: 0
spi-1: 0
spi-1: 0
spi-1: 0
spi-1: 0
spi-1: 0
spi-1: 0
spi-1: 0
spi-1: 0
spi-1: 0
spi-1: 08
spi-1: 00
avr_isp-1: Read fuse high bits: 0xdf
spi-1: 1
spi-1: 1
spi-1: 1
spi-1: 1
spi-1: 1
spi-1: 0
spi-1: 1
spi-1: 1
spi-1: 0
spi-1: 0
spi-1: 0
spi-1: 0
spi-1: 0
spi-1: 0
spi-1: 0
spi-1: 0
spi-1: DF
spi-1: 00
spi-1: 0
spi-1: 0
spi-1: 0
spi-1: 0
spi-1: 0
spi-1: 0
spi-1: 0
spi-1: 0
spi-1: 0
spi-1: 0
spi-1: 0
spi-1: 0
spi-1: 1
spi-1: 0
spi-1: 1
spi-1: 0
spi-1: 00
spi-1: 50
spi-1: 0
spi-1: 0
spi-1: 0
spi-1: 0
spi-1: 1
spi-1: 0
spi-1: 1
spi-1: 0
spi-1: 0
spi-1: 0
spi-1: 0
spi-1: 1
spi-1: 0
spi-1: 0
spi-1: 0
spi-1: 0
spi-1: 50
spi-1: 08
spi-1: 0
spi-1: 0
spi-1: 0
spi-1: 1
spi-1: 0
spi-1: 0
spi-1: 0
spi-1: 0
spi-1: 0
spi-1: 0
spi-1: 0
spi-1: 0
spi-1: 0
spi-1: 0
spi-1: 0
spi-1: 0
spi-1: 08
spi-1: 00
avr_isp-1: Read extended fuse bits: 0xf9
spi-1: 1
spi-1: 0
spi-1: 0
spi-1: 1
spi-1: 1
spi-1: 1
spi-1: 1
spi-1: 1
spi-1: 0
spi-1: 0
spi-1: 0
spi-1: 0
spi-1: 0
spi-1: 0
spi-1: 0
spi-1: 0
spi-1: F9
spi-1: 00
spi-1: 0
spi-1: 0
spi-1: 0
spi-1: 0
spi-1: 0
spi-1: 0
spi-1: 0
spi-1: 0
spi-1: 0
spi-1: 0
spi-1: 0
spi-1: 0
spi-1: 1
spi-1: 0
spi-1: 1
spi-1: 0
spi-1: 00
spi-1: 50
spi-1: 0
spi-1: 0
spi-1: 0
spi-1: 0
spi-1: 1
spi-1: 0
spi-1: 1
spi-1: 0
spi-1: 0
spi-1: 0
spi-1: 0
spi-1: 1
spi-1: 0
spi-1: 0
spi-1: 0
spi-1: 0
spi-1: 50
spi-1: 08
spi-1: 0
spi-1: 0
spi-1: 0
spi-1: 1
spi-1: 0
spi-1: 0
spi-1: 0
spi-1: 0
spi-1: 0
spi-1: 0
spi-1: 0
spi-1: 0
spi-1: 0
spi-1: 0
spi-1: 0
spi-1: 0
spi-1: 08
spi-1: 00
avr_isp-1: Read extended fuse bits: 0xf9
spi-1: 1
spi-1: 0
spi-1: 0
spi-1: 1
spi-1: 1
spi-1: 1
spi-1: 1
spi-1: 1
spi-1: 0
spi-1: 0
spi-1: 0
spi-1: 0
spi-1: 0
spi-1: 0
spi-1: 0
spi-1: 0
spi-1: F9
spi-1: 00
spi-1: 0
spi-1: 0
spi-1: 0
spi-1: 0
spi-1: 0
spi-1: 0
spi-1: 0
spi-1: 0
spi-1: 0
spi-1: 0
spi-1: 0
spi-1: 0
spi-1: 1
spi-1: 0
spi-1: 1
spi-1: 0
spi-1: 00
spi-1: 50
spi-1: 0
spi-1: 0
spi-1: 0
spi-1: 0
spi-1: 1
spi-1: 0
spi-1: 1
spi-1: 0
spi-1: 0
spi-1: 0
spi-1: 0
spi-1: 1
spi-1: 0
spi-1: 0
spi-1: 0
spi-1: 0
spi-1: 50
spi-1: 08
spi-1: 0
spi-1: 0
spi-1: 0
spi-1: 1
spi-1: 0
spi-1: 0
spi-1: 0
spi-1: 0
spi-1: 0
spi-1: 0
spi-1: 0
spi-1: 0
spi-1: 0
spi-1: 0
spi-1: 0
spi-1: 0
spi-1: 08
spi-1: 00
avr_isp-1: Read extended fuse bits: 0xf9
spi-1: 1
spi-1: 0
spi-1: 0
spi-1: 1
spi-1: 1
spi-1: 1
spi-1: 1
spi-1: 1
spi-1: 0
spi-1: 0
spi-1: 0
spi-1: 0
spi-1: 0
spi-1: 0
spi-1: 0
spi-1: 0
spi-1: F9
spi-1: 00
